{
  "cyclomatic": {
    "src/weorold/assessment/trajectory.py:block:assess_trajectory": 21,
    "src/weorold/debug/serialize.py:block:simulation_payload": 19,
    "src/weorold/domain/body.py:block:validate_body_value": 14,
    "src/weorold/domain/exposure.py:block:ThermalExposure": 17,
    "src/weorold/domain/exposure.py:method:ThermalExposure.__post_init__": 16,
    "src/weorold/environment/microclimate.py:method:DynamicMicroenvironment.__post_init__": 15,
    "src/weorold/environment/models.py:block:WeatherPoint": 21,
    "src/weorold/environment/models.py:method:WeatherPoint.__post_init__": 20,
    "src/weorold/environment/surfaces.py:block:SurfaceProperties": 16,
    "src/weorold/environment/surfaces.py:method:SurfaceEnergyModel.advance": 12,
    "src/weorold/environment/surfaces.py:method:SurfaceProperties.__post_init__": 15,
    "src/weorold/exposure/compiler.py:block:compile_activity_exposure": 11,
    "src/weorold/exposure/route.py:block:compile_route_exposure": 12,
    "src/weorold/gear/dynamics.py:method:GarmentEnsemble.prepare_step": 15,
    "src/weorold/gear/garments.py:method:GarmentParameters.__post_init__": 14,
    "src/weorold/physiology/energetics.py:block:WorkloadEstimate": 11,
    "src/weorold/physiology/energetics.py:block:estimate_gradient_locomotion": 17,
    "src/weorold/physiology/jos3.py:block:_body_sequence": 15,
    "src/weorold/route/gpx.py:block:route_from_gpx_text": 15,
    "src/weorold/route/models.py:method:RouteContext.__post_init__": 19,
    "src/weorold/route/terrain.py:block:horizon_profile_from_elevation": 11,
    "src/weorold/sources/geospatial/arcgis.py:method:ArcGisImageSampleSource._batch": 17,
    "src/weorold/sources/geospatial/mrlc.py:method:GeoServerWmsPointSource._numeric_feature_value": 11,
    "src/weorold/sources/geospatial/mrlc.py:method:GeoServerWmsPointSource.resolve_layer": 15,
    "src/weorold/sources/geospatial/osm.py:block:OsmRouteSurfaceSource": 11,
    "src/weorold/sources/geospatial/osm.py:method:OsmRouteSurfaceSource.fetch": 18,
    "src/weorold/sourceweorold._transport.py:method:CachedHttpClient.get": 17,
    "src/weorold/sources/route_inputs.py:block:prepare_us_route_inputs": 37,
    "src/weorold/sources/weather/nws.py:block:NwsWeatherSource": 25,
    "src/weorold/sources/weather/nws.py:block:_parse_series": 11,
    "src/weorold/sources/weather/nws.py:method:NwsWeatherSource.fetch": 24,
    "src/weorold/sources/weather/open_meteo.py:block:OpenMeteoWeatherSource": 30,
    "src/weorold/sources/weather/open_meteo.py:method:OpenMeteoWeatherSource.fetch": 29
  },
  "halstead": {
    "bugs": {
      "src/weorold/environment/microclimate.py": 0.7312882955284356,
      "src/weorold/environment/solar.py": 0.6548221284110095,
      "src/weorold/environment/surfaces.py": 0.6267944974765771,
      "src/weorold/exposure/route.py": 0.6274776496051737,
      "src/weorold/gear/dynamics.py": 1.058078776488565,
      "src/weorold/physiology/energetics.py": 0.937368745514432,
      "src/weorold/physiology/jos3.py": 0.4558917858506101,
      "src/weorold/route/geometry.py": 0.5293845639396985,
      "src/weorold/route/models.py": 0.613286789004485,
      "src/weorold/route/terrain.py": 0.4107104136308088,
      "src/weorold/sources/geospatial/osm.py": 0.40816050757683403,
      "src/weorold/sources/route_inputs.py": 0.35006659660778094,
      "src/weorold/sources/weather/nws.py": 0.7434088905924829
    },
    "difficulty": {
      "src/weorold/environment/timeline.py": 10.9375,
      "src/weorold/exposure/compiler.py": 10.390243902439025,
      "src/weorold/exposure/route.py": 12.461864406779661,
      "src/weorold/physiology/energetics.py": 12.272189349112425,
      "src/weorold/physiology/jos3.py": 11.142857142857142,
      "src/weorold/route/geometry.py": 11.325,
      "src/weorold/route/models.py": 10.630434782608695,
      "src/weorold/route/terrain.py": 11.393617021276595,
      "src/weorold/sources/geospatial/mrlc.py": 11.547619047619047,
      "src/weorold/sources/geospatial/osm.py": 10.577777777777778,
      "src/weorold/sourceweorold._transport.py": 10.266666666666667,
      "src/weorold/sources/route_inputs.py": 12.169014084507042,
      "src/weorold/sources/weather/nws.py": 12.394039735099337,
      "src/weorold/sources/weather/open_meteo.py": 10.625
    },
    "effort": {
      "src/weorold/environment/microclimate.py": 15653.52243401408,
      "src/weorold/environment/solar.py": 16134.817244047274,
      "src/weorold/environment/surfaces.py": 16107.160923525993,
      "src/weorold/exposure/route.py": 23458.624162993423,
      "src/weorold/gear/dynamics.py": 30959.67488465171,
      "src/weorold/physiology/energetics.py": 34510.70020467926,
      "src/weorold/physiology/jos3.py": 15239.811127006109,
      "src/weorold/route/geometry.py": 17985.84055985125,
      "src/weorold/route/models.py": 19558.515640643032,
      "src/weorold/route/terrain.py": 14038.431478678602,
      "src/weorold/sources/geospatial/mrlc.py": 11032.37741844107,
      "src/weorold/sources/geospatial/osm.py": 12952.2934404382,
      "src/weorold/sources/route_inputs.py": 12779.896033906594,
      "src/weorold/sources/weather/nws.py": 27641.517988288047
    },
    "volume": {
      "src/weorold/environment/microclimate.py": 2193.8648865853065,
      "src/weorold/environment/solar.py": 1964.4663852330286,
      "src/weorold/environment/surfaces.py": 1880.3834924297314,
      "src/weorold/exposure/route.py": 1882.4329488155213,
      "src/weorold/gear/dynamics.py": 3174.2363294656952,
      "src/weorold/physiology/energetics.py": 2812.106236543296,
      "src/weorold/physiology/jos3.py": 1367.6753575518303,
      "src/weorold/route/geometry.py": 1588.1536918190952,
      "src/weorold/route/models.py": 1839.860367013455,
      "src/weorold/route/terrain.py": 1232.1312408924264,
      "src/weorold/sources/geospatial/osm.py": 1224.481522730502,
      "src/weorold/sources/route_inputs.py": 1050.1997898233428,
      "src/weorold/sources/weather/nws.py": 2230.2266717774487
    }
  },
  "maintainability": {},
  "raw_sloc": {
    "src/weorold/exposure/route.py": 425,
    "src/weorold/physiology/jos3.py": 408,
    "src/weorold/sources/route_inputs.py": 453
  },
  "thresholds": {
    "cyclomatic_ceiling": 21,
    "cyclomatic_ratchet": 11,
    "cyclomatic_tolerance": 0,
    "halstead_bugs_ceiling": 1.25,
    "halstead_bugs_ratchet": 0.33,
    "halstead_bugs_tolerance": 0.005,
    "halstead_difficulty_ceiling": 15.0,
    "halstead_difficulty_ratchet": 10.0,
    "halstead_difficulty_tolerance": 0.1,
    "halstead_effort_ceiling": 30000.0,
    "halstead_effort_ratchet": 10000.0,
    "halstead_effort_tolerance": 100.0,
    "halstead_volume_ceiling": 4000.0,
    "halstead_volume_ratchet": 1000.0,
    "halstead_volume_tolerance": 5.0,
    "maintainability_ratchet": 20.0,
    "maintainability_tolerance": 0.25,
    "raw_sloc_ceiling": 800,
    "raw_sloc_ratchet": 400,
    "raw_sloc_tolerance": 5
  },
  "version": 1
}
